{
  "schema_version": "1.0",
  "session_id": "S2D1",
  "site": {"site_id": "S2", "water_body": "lake", "lat": 52.0000, "lon": -1.0000, "bottom_type": "sand",
           "depth_m": {"min": 2.0, "max": 6.5}, "current_m_s": 0.0, "ice_cover": false},
  "environment": {"temperature_c": 14.2, "salinity_psu": 0.2, "sound_speed_m_s": 1463.8,
                  "sound_speed_source": "temperature_formula", "turbidity_ntu": 8.0, "wind_m_s": 3.0,
                  "boat_traffic": "light", "rain": false},
  "device": {"model": "handheld-dual", "serial": "HD-0007", "firmware": "1.4.2", "frequencies_khz": [80, 200],
             "range_setting_m": 50, "gain_mode": "fixed", "gain_db": 12, "raw_recording": true, "imu": true},
  "crew": {"operator_id": "op03", "diver_or_camera": "drop_camera"},
  "placements": [
    {"placement_id": "S2D1-01", "kind": "empty_sweep", "slot": 1,
     "start_utc": "2027-05-04T08:02:00Z", "end_utc": "2027-05-04T08:06:00Z",
     "passes": [{"pass_id": 1, "file": "S2D1/S2D1-01_p1.raw", "sha256": "0000000000000000000000000000000000000000000000000000000000000000", "n_pings": 120}]},
    {"placement_id": "S2D1-02", "kind": "body", "slot": 2,
     "start_utc": "2027-05-04T08:15:00Z", "end_utc": "2027-05-04T08:31:00Z",
     "target": {"type": "tissue_phantom", "proxy_spec": "PHANTOM-A, 70 kg, lungs 1.5 L air", "pose": "prone",
                "clothing": "heavy", "on_bottom": true, "range_m": 20, "depth_m": 4.8},
     "ground_truth": {"method": "gps_buoy_and_camera", "lat": 52.00012, "lon": -0.99985,
                      "position_error_m": 1.5, "heading_deg": 135, "confirmed_utc": "2027-05-04T08:14:00Z"},
     "passes": [
       {"pass_id": 1, "file": "S2D1/S2D1-02_p1.raw", "sha256": "1111111111111111111111111111111111111111111111111111111111111111", "n_pings": 64,
        "qa": {"saturation": 0.0, "dropped_rows": 0.0, "dead_beams": 0.0, "low_signal": 0.0, "tilt_out_of_range": 0.02, "metadata_complete": true}}
     ],
     "check_time_s": 210}
  ],
  "labels": [
    {"placement_id": "S2D1-02", "pass_id": 1, "labeller_id": "lab01", "blind": true, "label": "body",
     "ping_range": [12, 40], "range_m": 19.6, "bearing_deg": 3.5, "confidence": "A"}
  ]
}
